{
  "schemaVersion": 1,
  "project": "llunde-backend",
  "environment": "production",
  "image": "ghcr.io/fredrir/llunde-backend@sha256:aaaaaaaaaaaaaaaaaaaaaaaaaaaaaaaaaaaaaaaaaaaaaaaaaaaaaaaaaaaaaaaa",
  "sourceRevision": "bbbbbbbbbbbbbbbbbbbbbbbbbbbbbbbbbbbbbbbb",
  "provenance": {
    "workflowRepository": "fredrir/llunde-infra",
    "workflowRevision": "cccccccccccccccccccccccccccccccccccccccc",
    "workflowPath": ".github/workflows/project-ci.yml",
    "repositoryId": 1327945675,
    "runId": 1,
    "platforms": [
      "linux/amd64",
      "linux/arm64"
    ]
  }
}
